<?xml version="1.0" encoding="utf-8"?>
<DanhSachTinTuc xmlns:xsi="http://www.w3.org/2001/XMLSchema-instance" xsi:noNamespaceSchemaLocation="TinTuc.xsd">
  <TinTuc>
    <MaTT>TT061</MaTT>
    <TieuDe>Dùng AI 'độ' giao diện smart TV</TieuDe>
    <TomTat>Không hài lòng với giao diện mặc định, một số người thử dùng AI để tự thay đổi giao diện smart TV theo nhu cầu cá nhân.</TomTat>
    <NoiDung>Không hài lòng với giao diện mặc định, một số người thử dùng AI để tự thay đổi giao diện smart TV theo nhu cầu cá nhân.
Theo ghi nhận thực tế từ các chuyên trang công nghệ uy tín, thị trường smartphone và thiết bị thông minh đang trải qua giai đoạn phát triển mạnh mẽ với nhiều đột phá về AI, chip bán dẫn và thiết kế. Độc giả có thể tham khảo các mẫu máy liên quan trong danh mục sản phẩm tại PhoneStore để nhận ưu đãi hấp dẫn nhất.</NoiDung>
    <HinhAnh>https://i1-vnexpress.vnecdn.net/2026/10/20/TV2-1792473219-4243-1792473340.jpg?w=1200&amp;h=0&amp;q=100&amp;dpr=1&amp;fit=crop&amp;s=VejwYdhVK5n_do-RLsgNzw</HinhAnh>
    <NgayDang>2026-10-20 14:30</NgayDang>
    <DanhMuc>Công nghệ AI</DanhMuc>
    <TacGia>VnExpress Số Hóa</TacGia>
    <LienKetGoc>https://vnexpress.net/dung-ai-do-giao-dien-smart-tv-5134574.html</LienKetGoc>
    <LuotXem>80</LuotXem>
    <NoiBat>true</NoiBat>
  </TinTuc>
  <TinTuc>
    <MaTT>TT062</MaTT>
    <TieuDe>Tại sao các hãng công nghệ tự làm chip AI?</TieuDe>
    <TomTat>Microsoft, Google một mặt hợp tác với hãng chip AI lớn nhất thế giới Nvidia, một mặt vẫn có dự án riêng, nhưng không phải để cạnh tranh trực tiếp.</TomTat>
    <NoiDung>Microsoft, Google một mặt hợp tác với hãng chip AI lớn nhất thế giới Nvidia, một mặt vẫn có dự án riêng, nhưng không phải để cạnh tranh trực tiếp.
Theo ghi nhận thực tế từ các chuyên trang công nghệ uy tín, thị trường smartphone và thiết bị thông minh đang trải qua giai đoạn phát triển mạnh mẽ với nhiều đột phá về AI, chip bán dẫn và thiết kế. Độc giả có thể tham khảo các mẫu máy liên quan trong danh mục sản phẩm tại PhoneStore để nhận ưu đãi hấp dẫn nhất.</NoiDung>
    <HinhAnh>https://i1-vnexpress.vnecdn.net/2026/10/19/a1-1792403352.jpg?w=1200&amp;h=0&amp;q=100&amp;dpr=1&amp;fit=crop&amp;s=DBOf5F7tDa-0uLI7FTDoOw</HinhAnh>
    <NgayDang>2026-10-20 10:00</NgayDang>
    <DanhMuc>Công nghệ AI</DanhMuc>
    <TacGia>VnExpress Số Hóa</TacGia>
    <LienKetGoc>https://vnexpress.net/tai-sao-cac-hang-cong-nghe-tu-lam-chip-ai-5134331.html</LienKetGoc>
    <LuotXem>97</LuotXem>
    <NoiBat>true</NoiBat>
  </TinTuc>
  <TinTuc>
    <MaTT>TT063</MaTT>
    <TieuDe>Anthropic giảm nhân viên cấp thấp, tăng họp do AI</TieuDe>
    <TomTat>Anthropic, nhà phát triển chatbot Claude, cho biết cơ cấu nhân sự và cách làm việc tại startup này đã thay đổi đáng kể sau khi ứng dụng AI.</TomTat>
    <NoiDung>Anthropic, nhà phát triển chatbot Claude, cho biết cơ cấu nhân sự và cách làm việc tại startup này đã thay đổi đáng kể sau khi ứng dụng AI.
Theo ghi nhận thực tế từ các chuyên trang công nghệ uy tín, thị trường smartphone và thiết bị thông minh đang trải qua giai đoạn phát triển mạnh mẽ với nhiều đột phá về AI, chip bán dẫn và thiết kế. Độc giả có thể tham khảo các mẫu máy liên quan trong danh mục sản phẩm tại PhoneStore để nhận ưu đãi hấp dẫn nhất.</NoiDung>
    <HinhAnh>https://i1-vnexpress.vnecdn.net/2026/10/19/dsc03648jpg-1792383014-5586-1792383267.jpg?w=1200&amp;h=0&amp;q=100&amp;dpr=1&amp;fit=crop&amp;s=Ufbd2FiYIGWBWQVp2SN9iw</HinhAnh>
    <NgayDang>2026-10-20 05:00</NgayDang>
    <DanhMuc>Tin công nghệ</DanhMuc>
    <TacGia>VnExpress Số Hóa</TacGia>
    <LienKetGoc>https://vnexpress.net/anthropic-giam-nhan-vien-cap-thap-tang-hop-do-ai-5134145.html</LienKetGoc>
    <LuotXem>115</LuotXem>
    <NoiBat>true</NoiBat>
  </TinTuc>
  <TinTuc>
    <MaTT>TT064</MaTT>
    <TieuDe>TP HCM trả lương đến 100 triệu đồng cho chuyên gia nông nghiệp công nghệ cao</TieuDe>
    <TomTat>Ban Quản lý Khu nông nghiệp công nghệ cao TP HCM tuyển chuyên gia, nhà khoa học thu nhập 50-100 triệu đồng/tháng, khuyến khích nghiên cứu đến một tỷ đồng.</TomTat>
    <NoiDung>Ban Quản lý Khu nông nghiệp công nghệ cao TP HCM tuyển chuyên gia, nhà khoa học thu nhập 50-100 triệu đồng/tháng, khuyến khích nghiên cứu đến một tỷ đồng.
Theo ghi nhận thực tế từ các chuyên trang công nghệ uy tín, thị trường smartphone và thiết bị thông minh đang trải qua giai đoạn phát triển mạnh mẽ với nhiều đột phá về AI, chip bán dẫn và thiết kế. Độc giả có thể tham khảo các mẫu máy liên quan trong danh mục sản phẩm tại PhoneStore để nhận ưu đãi hấp dẫn nhất.</NoiDung>
    <HinhAnh>https://i1-vnexpress.vnecdn.net/2026/10/20/1K5C1UFCP4IU7MF-1792480134-7746-1792480140.jpg?w=1200&amp;h=0&amp;q=100&amp;dpr=1&amp;fit=crop&amp;s=LlA6MUlovWft75uWxX733Q</HinhAnh>
    <NgayDang>2026-10-20 13:32</NgayDang>
    <DanhMuc>Tin công nghệ</DanhMuc>
    <TacGia>VnExpress Số Hóa</TacGia>
    <LienKetGoc>https://vnexpress.net/tp-hcm-tra-luong-den-100-trieu-dong-cho-chuyen-gia-nong-nghiep-cong-nghe-cao-5134566.html</LienKetGoc>
    <LuotXem>131</LuotXem>
    <NoiBat>false</NoiBat>
  </TinTuc>
  <TinTuc>
    <MaTT>TT065</MaTT>
    <TieuDe>Mỹ cấm dùng DeepSeek trong hệ thống cơ quan chính phủ</TieuDe>
    <TomTat>Các cơ quan dân sự Mỹ được yêu cầu loại bỏ và không được mua sản phẩm DeepSeek cũng như các dịch vụ bên thứ ba có sử dụng AI Trung Quốc này.</TomTat>
    <NoiDung>Các cơ quan dân sự Mỹ được yêu cầu loại bỏ và không được mua sản phẩm DeepSeek cũng như các dịch vụ bên thứ ba có sử dụng AI Trung Quốc này.
Theo ghi nhận thực tế từ các chuyên trang công nghệ uy tín, thị trường smartphone và thiết bị thông minh đang trải qua giai đoạn phát triển mạnh mẽ với nhiều đột phá về AI, chip bán dẫn và thiết kế. Độc giả có thể tham khảo các mẫu máy liên quan trong danh mục sản phẩm tại PhoneStore để nhận ưu đãi hấp dẫn nhất.</NoiDung>
    <HinhAnh>https://i1-vnexpress.vnecdn.net/2026/10/20/dsc09975jpg-1792470055-1335-1792470216.jpg?w=1200&amp;h=0&amp;q=100&amp;dpr=1&amp;fit=crop&amp;s=0soP-fjL05LNceQCBqcE7A</HinhAnh>
    <NgayDang>2026-10-20 11:41</NgayDang>
    <DanhMuc>Tin công nghệ</DanhMuc>
    <TacGia>VnExpress Số Hóa</TacGia>
    <LienKetGoc>https://vnexpress.net/my-cam-dung-deepseek-trong-he-thong-co-quan-chinh-phu-5134558.html</LienKetGoc>
    <LuotXem>148</LuotXem>
    <NoiBat>false</NoiBat>
  </TinTuc>
  <TinTuc>
    <MaTT>TT066</MaTT>
    <TieuDe>Giám đốc nhà máy Intel: 'Kỹ sư bán dẫn trẻ hãy kiên trì với hành trình'</TieuDe>
    <TomTat>Kỹ sư Việt có nền tảng, tiếp thu nhanh, nhưng cần kiên trì tích lũy chuyên môn sâu về bán dẫn, theo Giám đốc nhà máy Intel Nguyễn Quang Khánh.</TomTat>
    <NoiDung>Kỹ sư Việt có nền tảng, tiếp thu nhanh, nhưng cần kiên trì tích lũy chuyên môn sâu về bán dẫn, theo Giám đốc nhà máy Intel Nguyễn Quang Khánh.
Theo ghi nhận thực tế từ các chuyên trang công nghệ uy tín, thị trường smartphone và thiết bị thông minh đang trải qua giai đoạn phát triển mạnh mẽ với nhiều đột phá về AI, chip bán dẫn và thiết kế. Độc giả có thể tham khảo các mẫu máy liên quan trong danh mục sản phẩm tại PhoneStore để nhận ưu đãi hấp dẫn nhất.</NoiDung>
    <HinhAnh>https://i1-vnexpress.vnecdn.net/2026/10/16/cha-n-dung-doanh-nha-n-giu-a-a-2909-9678-1792149276.png?w=1200&amp;h=0&amp;q=100&amp;dpr=1&amp;fit=crop&amp;s=x_BOzULW2LGfdwZbIkxaEA</HinhAnh>
    <NgayDang>2026-10-20 09:00</NgayDang>
    <DanhMuc>Công nghệ AI</DanhMuc>
    <TacGia>VnExpress Số Hóa</TacGia>
    <LienKetGoc>https://vnexpress.net/giam-doc-nha-may-intel-ky-su-ban-dan-tre-hay-kien-tri-voi-hanh-trinh-5133364.html</LienKetGoc>
    <LuotXem>165</LuotXem>
    <NoiBat>false</NoiBat>
  </TinTuc>
  <TinTuc>
    <MaTT>TT067</MaTT>
    <TieuDe>Samsung dự kiến ra 6 điện thoại gập Galaxy Z 2027</TieuDe>
    <TomTat>Samsung được cho là lên kế hoạch mở rộng dải sản phẩm Galaxy Z 2027, nổi bật là thiết bị màn hình cuộn Galaxy Z Slide và điện thoại gập ba thế hệ hai.</TomTat>
    <NoiDung>Samsung được cho là lên kế hoạch mở rộng dải sản phẩm Galaxy Z 2027, nổi bật là thiết bị màn hình cuộn Galaxy Z Slide và điện thoại gập ba thế hệ hai.
Theo ghi nhận thực tế từ các chuyên trang công nghệ uy tín, thị trường smartphone và thiết bị thông minh đang trải qua giai đoạn phát triển mạnh mẽ với nhiều đột phá về AI, chip bán dẫn và thiết kế. Độc giả có thể tham khảo các mẫu máy liên quan trong danh mục sản phẩm tại PhoneStore để nhận ưu đãi hấp dẫn nhất.</NoiDung>
    <HinhAnh>https://i1-vnexpress.vnecdn.net/2026/10/18/from-trifold-to-galaxy-z-slide-2509-9117-1792333351.webp?w=1200&amp;h=0&amp;q=100&amp;dpr=1&amp;fit=crop&amp;s=uQxyXiUBxmhcG87_rebpZA</HinhAnh>
    <NgayDang>2026-10-20 06:37</NgayDang>
    <DanhMuc>Samsung</DanhMuc>
    <TacGia>VnExpress Số Hóa</TacGia>
    <LienKetGoc>https://vnexpress.net/samsung-du-kien-ra-6-dien-thoai-gap-galaxy-z-2027-5133915.html</LienKetGoc>
    <LuotXem>182</LuotXem>
    <NoiBat>false</NoiBat>
  </TinTuc>
  <TinTuc>
    <MaTT>TT068</MaTT>
    <TieuDe>Thần đồng AI 17 tuổi bất ngờ rời công ty Trung Quốc</TieuDe>
    <TomTat>Nathan Chen, nhà nghiên cứu đứng sau thành công của mô hình Kimi K3, thông báo rời công ty Moonshot AI sau chưa đầy một năm làm việc, dấy lên nhiều suy đoán về bến đỗ tiếp theo của thần đồng tuổi teen này.</TomTat>
    <NoiDung>Nathan Chen, nhà nghiên cứu đứng sau thành công của mô hình Kimi K3, thông báo rời công ty Moonshot AI sau chưa đầy một năm làm việc, dấy lên nhiều suy đoán về bến đỗ tiếp theo của thần đồng tuổi teen này.
Theo ghi nhận thực tế từ các chuyên trang công nghệ uy tín, thị trường smartphone và thiết bị thông minh đang trải qua giai đoạn phát triển mạnh mẽ với nhiều đột phá về AI, chip bán dẫn và thiết kế. Độc giả có thể tham khảo các mẫu máy liên quan trong danh mục sản phẩm tại PhoneStore để nhận ưu đãi hấp dẫn nhất.</NoiDung>
    <HinhAnh>https://i1-vnexpress.vnecdn.net/2026/10/19/VNEProdigy-1792405084-7920-1792405419.jpg?w=1200&amp;h=0&amp;q=100&amp;dpr=1&amp;fit=crop&amp;s=GxbMdF8ukepH45ePRM_PFQ</HinhAnh>
    <NgayDang>2026-10-20 00:00</NgayDang>
    <DanhMuc>Công nghệ AI</DanhMuc>
    <TacGia>VnExpress Số Hóa</TacGia>